{
  "$schema": "https://json-schema.org/draft/2020-12/schema",
  "title": "TraceEnvelope",
  "type": "object",
  "additionalProperties": false,
  "description": "문진 서비스가 ops-feedback에 보내는 한 턴의 기록 봉투. 문진 스키마의 TurnTrace를 수정하지 않고 릴리스 정보를 붙인다. 수집 쪽은 (session_id, turn_id)로 중복을 제거한다. trace는 runtime_contract_version에 해당하는 문진 스키마의 TurnTrace로 별도 검증하며, 여기서는 구조만 본다.",
  "required": [
    "pipeline_schema_version",
    "release_id",
    "runtime_contract_version",
    "session_id",
    "turn_id",
    "sent_at",
    "trace"
  ],
  "properties": {
    "pipeline_schema_version": {
      "$ref": "_common.schema.json#/$defs/PipelineSchemaVersion"
    },
    "release_id": {
      "$ref": "_common.schema.json#/$defs/Id"
    },
    "runtime_contract_version": {
      "$ref": "_common.schema.json#/$defs/RuntimeContractVersion"
    },
    "session_id": {
      "$ref": "_common.schema.json#/$defs/Id"
    },
    "turn_id": {
      "$ref": "_common.schema.json#/$defs/Id"
    },
    "sent_at": {
      "$ref": "_common.schema.json#/$defs/Timestamp"
    },
    "trace": {
      "type": "object",
      "description": "문진 스키마의 TurnTrace 전체."
    },
    "ext": {
      "type": "object",
      "description": "영역이 계약을 바꾸지 않고 덧붙이는 부가 정보. 키는 영역 이름(예: 'model-lab')이고 값은 그 영역이 정한다. 다른 영역은 이해하지 못해도 보존하고 전달해야 하며, 판단에 쓰지 않는다. 여러 영역이 필요로 하게 되면 정식 필드로 올린다."
    }
  }
}
